{
  "kind": "agent-journal/foundation-parity",
  "version": "0.1",
  "reviewed": "2026-10-23",
  "meaning": "The Tier 1 parity ledger: every field of foundation-fields.json is assigned to exactly one facet, a Journal correspondence with its tier, semantic-definition state, per-route availability and the concrete next action. Facets reference mapping-catalog concept ids or name a proposed concept; they are reviewed claims, not executed tests. ParityLedgerTest joins them with the catalog, the claims and this build's CLI coverage calculation and generates PARITY.md and parity.json. Tiers: 1 foundational parity, 2 Journal improvement, 3 consumer analysis, out_of_scope_proposed an exclusion awaiting review.",
  "inventory": "foundation-fields.json",
  "routes": [
    "claude-code/stream-json/2.1.304-stdout",
    "codex-cli/exec-json-stream/0.160.1",
    "antigravity-cli/stream-json/1.4.6-stdout"
  ],
  "vocabularies": {
    "tier": [
      "1",
      "2",
      "3",
      "out_of_scope_proposed"
    ],
    "definition": [
      "defined",
      "partial",
      "missing",
      "unresolved"
    ],
    "state": [
      "covered",
      "partial",
      "not_exercised",
      "source_limited",
      "derivable",
      "mapper_missing",
      "definition_missing",
      "definition_unresolved",
      "excluded_proposed",
      "tier3_consumer"
    ],
    "relation": [
      "equivalent",
      "adapted",
      "finer",
      "coarser",
      "different",
      "none"
    ],
    "route": [
      "mapped",
      "unexercised",
      "retained_only",
      "source_limited",
      "not_applicable"
    ]
  },
  "facets": [
    {
      "id": "identity.session",
      "group": "identity",
      "summary": "The conversation (session, thread) every operation belongs to",
      "fields": [
        "otel_genai.semconv:attribute:gen_ai.conversation.id",
        "openinference.semconv:attribute:session.id",
        "weave.agents_schema:field:AgentSpanSchema.conversation_id",
        "weave.agents_schema:ingest_attribute:weave.conversation.id"
      ],
      "concepts": [
        "session-identity"
      ],
      "proposal": null,
      "destinations": [
        "model_response.session_uid",
        "prompt_turn.session_uid",
        "tool_call.session_uid",
        "session_context.session_uid",
        "source_record.session_uid"
      ],
      "relation": "adapted",
      "differences": "Same meaning; Journal requires the CLI-reported native id on every event and never assigns one (OTel: MUST NOT fabricate; OI/Weave: whatever the instrumentation sets).",
      "tier": "1",
      "tier_reason": "Execution information represented by a Tier 1 foundation",
      "definition": "defined",
      "state": "covered",
      "routes": {
        "claude-code/stream-json/2.1.304-stdout": "mapped",
        "codex-cli/exec-json-stream/0.160.1": "mapped",
        "antigravity-cli/stream-json/1.4.6-stdout": "mapped"
      },
      "route_evidence": "Claude: session_id on every record; Codex: thread.started.thread_id; Antigravity: conversation_id on every record",
      "evidence": [],
      "action": "none"
    },
    {
      "id": "identity.session-name",
      "group": "identity",
      "summary": "A human-readable conversation name or title",
      "fields": [
        "weave.agents_schema:field:AgentSpanSchema.conversation_name",
        "weave.agents_schema:ingest_attribute:weave.conversation.name"
      ],
      "concepts": [],
      "proposal": {
        "id": "session-display-name",
        "question": "Did the source report a human-readable name for the session?"
      },
      "destinations": [],
      "relation": "none",
      "differences": "Journal has no session title attribute.",
      "tier": "1",
      "tier_reason": "Execution information represented by a Tier 1 foundation (Weave)",
      "definition": "missing",
      "state": "definition_missing",
      "routes": {
        "claude-code/stream-json/2.1.304-stdout": "source_limited",
        "codex-cli/exec-json-stream/0.160.1": "source_limited",
        "antigravity-cli/stream-json/1.4.6-stdout": "unexercised"
      },
      "route_evidence": "Neither pinned stream inventory has a session title family (Claude stream-json 2.1.304, Codex exec 0.160.1); native session summaries are SESSION-1 import territory, never stream enrichment; Antigravity: no conversation title in the documented payloads or the recordings; the documented inventory's completeness is not established (absence not established)",
      "evidence": [],
      "action": "Define an optional reported session display name (reported only, never generated); record route limitation"
    },
    {
      "id": "identity.main-agent",
      "group": "identity",
      "summary": "The top-level agent (the CLI product) running the execution",
      "fields": [
        "otel_genai.semconv:entity:gen_ai.main_agent",
        "otel_genai.semconv:attribute:gen_ai.main_agent.id",
        "otel_genai.semconv:attribute:gen_ai.main_agent.name",
        "otel_genai.semconv:attribute:gen_ai.main_agent.description"
      ],
      "concepts": [
        "session-identity"
      ],
      "proposal": null,
      "destinations": [
        "cli_agent.name",
        "cli_agent.version",
        "cli_agent.uid",
        "cli_agent.instance_uid",
        "cli_agent.product"
      ],
      "relation": "adapted",
      "differences": "cli_agent separates product name, CLI version, a stable logical agent id (only when the source reports one) and instance; OTel main_agent has id/name/description. No source reports a main-agent description.",
      "tier": "1",
      "tier_reason": "Execution information represented by a Tier 1 foundation",
      "definition": "defined",
      "state": "partial",
      "routes": {
        "claude-code/stream-json/2.1.304-stdout": "mapped",
        "codex-cli/exec-json-stream/0.160.1": "mapped",
        "antigravity-cli/stream-json/1.4.6-stdout": "mapped"
      },
      "route_evidence": "Claude: system/init claude_code_version; Codex: version from the launch probe (exec stream reports none); neither reports a stable agent id or description; Antigravity: version from the launch probe agy --version (the stream reports none); init reports cwd, permission mode and tools",
      "evidence": [],
      "action": "Keep; description and stable id stay source-limited on both routes"
    },
    {
      "id": "identity.invoked-agent",
      "group": "identity",
      "summary": "Identity of an invoked (sub-)agent: name/type, id, version, description",
      "fields": [
        "otel_genai.semconv:attribute:gen_ai.agent.id",
        "otel_genai.semconv:attribute:gen_ai.agent.name",
        "otel_genai.semconv:attribute:gen_ai.agent.version",
        "otel_genai.semconv:attribute:gen_ai.agent.description",
        "openinference.semconv:attribute:agent.name",
        "weave.agents_schema:field:AgentSpanSchema.agent_id",
        "weave.agents_schema:field:AgentSpanSchema.agent_name",
        "weave.agents_schema:field:AgentSpanSchema.agent_version",
        "weave.agents_schema:field:AgentSpanSchema.agent_description",
        "weave.agents_schema:field:AgentChatMessage.agent_name",
        "weave.agents_schema:field:AgentChatMessage.agent_version",
        "weave.agents_schema:ingest_attribute:weave.agent.id",
        "weave.agents_schema:ingest_attribute:weave.agent.name",
        "weave.agents_schema:ingest_attribute:weave.agent.version",
        "weave.agents_schema:ingest_attribute:weave.agent.description"
      ],
      "concepts": [
        "child-runs",
        "child-run-metadata"
      ],
      "proposal": null,
      "destinations": [],
      "relation": "none",
      "differences": "Journal links a child run to its spawning call but has no canonical sub-agent identity (type, id, description); the pending child-run-metadata concept owns it.",
      "tier": "1",
      "tier_reason": "Execution information represented by a Tier 1 foundation",
      "definition": "missing",
      "state": "mapper_missing",
      "routes": {
        "claude-code/stream-json/2.1.304-stdout": "retained_only",
        "codex-cli/exec-json-stream/0.160.1": "retained_only",
        "antigravity-cli/stream-json/1.4.6-stdout": "retained_only"
      },
      "route_evidence": "Claude: assistant/user agent_id, subagent_type, task_description and system/task_started subagent_type, description, spawn_depth retained (live); Codex: collab_tool_call receiver_thread_ids, agents_states retained (live); Antigravity: a subagent step's subagent_info (type_name, role, child conversation id) is kept as the spawn's result content; no child run is linked",
      "evidence": [],
      "action": "SEM-2: define child-run agent identity (reported type, id, description) and map Claude task/agent fields and Codex collab receivers"
    },
    {
      "id": "identity.response",
      "group": "identity",
      "summary": "The provider response identifier",
      "fields": [
        "otel_genai.semconv:attribute:gen_ai.response.id",
        "weave.agents_schema:field:AgentSpanSchema.response_id",
        "weave.agents_schema:ingest_attribute:weave.response.id"
      ],
      "concepts": [
        "model-response-identity"
      ],
      "proposal": null,
      "destinations": [
        "model_response.response_uid"
      ],
      "relation": "equivalent",
      "differences": "Same meaning since extension 0.6.0: response_uid is only a provider response id.",
      "tier": "1",
      "tier_reason": "Execution information represented by a Tier 1 foundation",
      "definition": "defined",
      "state": "covered",
      "routes": {
        "claude-code/stream-json/2.1.304-stdout": "mapped",
        "codex-cli/exec-json-stream/0.160.1": "source_limited",
        "antigravity-cli/stream-json/1.4.6-stdout": "source_limited"
      },